Fanpage,Page_Id,Post_Id,Message,Type,Date,Reactions,Likes,Comments,Shares,Fans,Page,ER
European Commission,107898832590939,107898832590939_610869024411564,"27 EU countries, a shared history and cultural identity. European Heritage sites are milestones in the creation of today’s Europe: they celebrate and symbolise ideals, values and integration. Thanks to these sites, we can experience firsthand the richness and diversity of our cultural and creative expressions, inherited from the past and treasured for the future. Since 2013, the European Heritage Label has been assigned to sites for their symbolic value, the role they have played in European history and the activities they offer. These sites bring the European Union and its citizens closer together. Did you visit any of these places? Let us know in the comments! #EuropeanUnion",photo,2023-04-20 16:10:26 UTC,543,421,66,56,1400000,Facebook,0.038785714
European Commission,107898832590939,107898832590939_610337137798086,"In the EU, almost 90 million persons with disabilities face hurdles when travelling or moving abroad. It is high time we change it. And this is why we are working to introduce the European Disability Card. Thanks to it, card holders would be able to simply travel across our Union and benefit from the same conditions, easily accessing services in all the 27 EU countries. A consultation on the introduction of the European Disability Card is now open! Share your view ➡️ https://europa.eu/!8nDtfx The European Disability Card would help us strengthen our #UnionOfEquality. #EUHaveYourSay #EUDisabilityRights",photo,2023-04-20 09:30:01 UTC,866,543,155,168,1400000,Facebook,0.061857143
European Commission,107898832590939,107898832590939_610346697797130,"25 years ago, the leaders and people of Northern Ireland decided to plant a seed in soil previously stained with blood and tears. The seed of peace and possibility for new generations, which has been growing ever since. Today President von der Leyen, has traveled to Queen's University in Belfast to pay tribute to all those who planted that seed. To all the visionary leaders who believed that while history shapes people, people can also shape history. With the Belfast/Good Friday Agreement, leaders of Northern Ireland, Ireland and the United Kingdom put an end to decades of violence. We will continue to do our part and to accompany them on the path of peace and prosperity. The future of Northern Ireland belongs to its people. #GoodFridayAgreement #EuropeanUnion",photo,2023-04-19 18:29:47 UTC,2005,1588,211,206,1400000,Facebook,0.143214286
European Commission,107898832590939,107898832590939_609798154518651,"??‍?? Only 54% of people aged 16-74 have basic digital skills in Europe. We need to do much better on digital skills and treat them with the same importance as reading and writing. That's why we have adopted two proposals for Council Recommendations on key enabling factors for digital education and on improving the provision of digital skills. The proposals will encourage EU countries to: ?? create national strategies for digital education and skills, ?? invest in digital equipment, tools and content for educational institutions, ?? support the development of digital skills in all sectors and all levels. ?? We are also launching a pilot European Digital Skills Certificate to help people get their digital skills recognised across Europe! Together, let’s empower every European with the skills they need to succeed in the digital world. #EuropeanYearOfSkills #EUDigitalEducation",photo,2023-04-19 09:30:00 UTC,577,417,73,87,1400000,Facebook,0.041214286
European Commission,107898832590939,107898832590939_609774724520994,"We need to invest in and strengthen our cybersecurity capabilities. Today we proposed the Cyber Solidarity Act to reinforce the EU’s coordinated actions to detect, prepare for and effectively respond to growing cybersecurity threats and incidents. Our proposal introduces a: ??️ European Cyber Shield, an infrastructure of Security Operations Centres across the EU to detect and act on cyber threats ?? Cyber Emergency Mechanism to strengthen preparedness ??️ Cybersecurity Incident Review Mechanism to assess significant incidents We also presented a dedicated Academy to help increase the number of skilled cybersecurity professionals in the EU by bringing together existing initiatives on cybersecurity skills and making them available on an online platform. #DigitalEU #EuropeanUnion",photo,2023-04-18 18:12:52 UTC,583,439,105,39,1400000,Facebook,0.041642857
European Commission,107898832590939,107898832590939_200989942729702,In the last decades China has become an economic powerhouse and a key global player. It is now reducing its dependency on the world while increasing the world’s dependency on itself. We need to develop a new approach. Speech by President von der Leyen in the European Parliament.,video,2023-04-18 10:24:57 UTC,6864,4114,1982,768,1400000,Facebook,0.490285714
European Commission,107898832590939,107898832590939_609141104584356,"Solidarity brings light in dark hours ?? 169 generators arrived last week in Ukraine from Australia, coordinated via the #rescEU energy hub in Poland. To date, the EU has coordinated some 3,000 power generators to Ukraine via donations and own reserves. These generators range from smaller sizes, capable of powering single households, to much larger models that can keep vital services such as hospitals and central heating points running. We will #StandWithUkraine for as long as needed. ??© Minderoo Foundation",photo,2023-04-17 15:43:08 UTC,3359,2540,579,240,1400000,Facebook,0.239928571
European Commission,107898832590939,107898832590939_607471164751350,"?? Every life lost and serious injury on our roads is avoidable. To help reduce the number of accidents, last month we proposed new rules that will make roads safer and simplify everyday life. Among others: ?? a new EU-wide digital driving licence, ❌ zero-tolerance rule on drink-driving, ?? tougher cross-border enforcement rules, ?? measures to prepare drivers for today's micro-mobility, ??‍?? valuable driving experience for young and novice drivers. Our goal is to halve road fatalities and serious injuries by 2030 and have no deaths on EU roads by 2050. Our proposals will steer the wheel towards safer roads, for everyone. #RoadSafety #VisionZero",photo,2023-04-16 10:30:00 UTC,1694,1303,275,116,1400000,Facebook,0.121
European Commission,107898832590939,107898832590939_607333704765096,"Climate change is wreaking havoc around the world with wildfires, floods and tropical storms. We need to be one step ahead to protect our homes and loved ones from these devastating disasters. This is where the EU Civil Protection Mechanism comes in. Aiming to make the world safer, the Mechanism pools resources and expertise from all EU countries and beyond. This enables us to respond quickly and effectively to climate-related emergencies. See how we're making a difference in Madagascar through our EU-funded disaster risk reduction programme. Together, let's build a safer and more resilient future with #EUCivilProtection. #TogetherOneStepAhead #ClimateAction",video,2023-04-15 15:30:01 UTC,495,300,145,50,1400000,Facebook,0.035357143
European Commission,107898832590939,107898832590939_607410874757379,"Where is the EU? All around you In 30 years, the Cohesion Fund has invested almost€179 billion in bridges, railways and so many other projects across our Union. The Fund focuses on EU countries with a gross national income below 90% of the EU average to boost convergence between European economies. Among many others, the Cohesion Fund has helped build the: ???? rail track Koper-Divača ???? hydroelectric powerplant in the dam of Alqueva. ???? tramway extension in Bratislava ???? Warsaw metro What EU funded project have you seen in your region? #EuropeanUnion #EUFunds",photo,2023-04-15 10:30:00 UTC,1100,840,166,94,1400000,Facebook,0.078571429
European Commission,107898832590939,107898832590939_606596981505435,"We must protect Europe’s cultural heritage. ????️⛪ From ancient castles and stunning landscapes to historic monuments, these treasures are a testament to the rich history and diversity of our continent. This year’s 7 most endangered cultural heritage sites in Europe are... ???? Kortrijk Railway Station, Kortrijk, Belgium, ???? Partisan Memorial Cemetery, Mostar, Bosnia and Herzegovina, ???? Tchakvinji Fortress, Zugdidi, Georgia, ???? Sisters’ House Ensemble, former Moravian settlement in Kleinwelka, Germany, ???? Memento Park, Budapest, Hungary, ???? Cultural Landscape of Sveti Stefan, Paštrovići, Montenegro, ???? Watermills of Bistrica, Petrovac na Mlavi, Serbia. The selection of the sites is based not only on the level of threat or the value of the cultural heritage site, but also on the commitment of the local community, and therefore the potential to save it. We are proud to support Europa Nostra and the European Investment Bank in running the 7 Most Endangered Programme, a civil society campaign aiming to shed light on and protect Europe’s collective cultural legacy. ?? Flickr: Europa Nostra #7MostEndangered #EuropeForCulture",photo,2023-04-14 15:30:14 UTC,2456,1962,265,229,1400000,Facebook,0.175428571
European Commission,107898832590939,107898832590939_606774014821065,"When you first called from this cell phone, you had no idea that in the future there would be no extra cost to call any EU country! 50 years ago, the first mobile phone call was made, and the world of communication changed forever. ???? Today, we can stay connected with our loved ones and work from anywhere, thanks to the mobile technology that has evolved over the decades. And with the EU roaming regulation, we can enjoy this connectivity without worrying about extra fees while traveling in the EU. With our roaming legislation extended for 10 more years, citizens from EEA ???? ???? ???? ???? can continue calling, texting, and surfing the internet with the same conditions when roaming abroad as at home. So, let's celebrate the past and the present of mobile technology, and roam like at home! Do you recall ?? having used this telephone? #Roaming #DigitalEU",photo,2023-04-14 09:30:00 UTC,811,606,71,134,1400000,Facebook,0.057928571
European Commission,107898832590939,107898832590939_606693588162441,Russia’s war crimes will not go unpunished. We are determined to ensure that the perpetrators of the barbaric acts committed during this invasion will pay for their crimes and that Russia will be held accountable for the crime of aggression. #StandWithUkraine,photo,2023-04-13 16:01:49 UTC,4112,2753,1102,257,1400000,Facebook,0.293714286
European Commission,107898832590939,107898832590939_606463751518758,"Greener, stronger, and better prepared for the future! Our Recovery and Resilience Facility is all about building a more resilient Europe for generations to come. From funding for green technologies, small- and medium-sized business and climate change adaptation, to supporting youth employment, healthcare projects and digital education, this facility is designed to benefit all EU countries and their citizens. With just over two years of existence and worth €723 billion, the Recovery and Resilience Facility has already been driving hundreds of reforms and investments across Europe – and more will come! Curious, how it benefits your country or region? Check out our interactive map and explore over 350 projects funded so far. #NextGenerationEU",photo,2023-04-13 10:30:36 UTC,1758,1227,358,173,1400000,Facebook,0.125571429
European Commission,107898832590939,107898832590939_606070161558117,"Imagine if 450 million people and 23 million companies could move and trade without barriers. A freedom worth €14.5 trillion and over €8.1 trillion in investments. This is the Single Market, Europe’s crown jewel and the world’s second exporter. A 30-year success story of breaking trade barriers, safeguarding consumers, and protecting the environment by: ?? developing 3,600 harmonised standards, from toy safety to packaging waste; ?? enabling 9% of EU enterprises with e-commerce sales to trade across Europe, while supporting more with the Digital Markets Act; ?? giving 3.4% of EU citizens employment opportunities in another EU country, while opening opportunities in deep and clean tech; ?? looking beyond the present, promoting an EU-wide circular economy and the net-zero industry; ?? and more... What else have we missed that changed your life? Tell us in the comments! #SingleMarket #EuropeanUnion",photo,2023-04-12 18:28:15 UTC,683,382,133,168,1400000,Facebook,0.048785714
European Commission,107898832590939,107898832590939_605454034953063,"Aware of anyone circumventing EU sanctions on Russia or Belarus? If the answer is yes, you can make an anonymous report to us. The information reported may relate to the following: ?? EU sanctions violations, ?? circumstances of violations, or ?? individuals, companies and third countries involved, that are not publicly known but are known to you. This can be past, ongoing or planned sanctions violations, but also attempts to circumvent EU sanctions. Violating EU sanctions will not pay off. #EuropeanUnion #StandWithUkraine",photo,2023-04-11 15:30:01 UTC,1673,801,687,185,1400000,Facebook,0.1195
European Commission,107898832590939,107898832590939_601574555341011,"?? Calling all cultural heritage experts! Ukrainian cultural legacy remains under considerable threat of further destruction and damage. One of the Kremlin's plans is to eliminate Ukrainian national identity – but we will not allow it. We are setting up a group of 25 experts to help safeguard Ukrainian cultural heritage. The group will include experts from ???? and will lay the groundwork for ????'s support in this area. If you're an expert in preserving cultural heritage, join us in safeguarding Ukraine's history. Don't miss this opportunity to make a difference! Apply by 25 April → https://europa.eu/!NrrJP3 #StandWithUkraine #EUsolidarity #ARTvsWAR",photo,2023-04-11 09:30:02 UTC,2199,1464,505,230,1400000,Facebook,0.157071429
European Commission,107898832590939,107898832590939_602023108629489,"Peace and prosperity must be re-won, day after day, generation after generation. 25 years ago, brave leaders made the impossible come true by signing the Good Friday (Belfast) Agreement. Thanks to it, there is a whole generation of young people in Northern Ireland who were born and raised in peace. After a quarter of a century of peace, we recently renewed our commitment to maintaining peace and prosperity with the Windsor Framework. It will preserve peace by avoiding a hard border on the island, while also protecting the integrity of the EU’s Single Market.",video,2023-04-10 15:30:00 UTC,3467,2200,957,310,1400000,Facebook,0.247642857
European Commission,107898832590939,107898832590939_601506378681162,"♻️ Reduce, reuse, recycle... repair! What do you do when your phone or laptop breaks? More often than not, it is easier to simply replace a defective device rather than repair it. Our recent proposal for the ‘right to repair’ aims to reduce waste, boost the repair sector and make repairs easier for consumers. Supporting the objectives of the EU Green Deal, the initiative is set to have a positive impact over the next 15 years on: ?? environment → 18.5 million less tons of greenhouse gas emissions, ?? economy → €15.6 billion savings for sellers and producers in the EU, ?? consumers → €176.5 billion savings. By repairing more goods and using them longer, EU consumers can not only enjoy sustainable consumption, but will also achieve considerable savings! #EUGreenDeal #RightToRepair",photo,2023-04-10 09:30:01 UTC,1062,833,126,103,1400000,Facebook,0.075857143
European Commission,107898832590939,107898832590939_600971722067961,"Thousands of children have been abducted and deported to Russia. They have been removed from their families and communities. They are being deprived of their childhood and their roots. This is yet another blatant attempt at erasing the Ukrainian identity. It is undeniable. It is unforgivable. And it is punishable. In partnership with the Ukrainian authorities and the Polish Prime Minister Morawiecki, we have launched an initiative aiming at bringing back these children. We will also organise a conference to pull together international pressure to take all possible measures to establish the whereabouts of these children. ?? “The last minute together” by Inga Dagilė for CreativesForUkraine #StandWithUkraine",photo,2023-04-09 15:30:00 UTC,3105,1980,718,407,1400000,Facebook,0.221785714
European Commission,107898832590939,107898832590939_601442878687512,"Pedaling our way to better health, a cleaner planet, and more affordable transportation has never been easier! The summer of 2023 will be a milestone for cycling. We will propose a European Declaration on Cycling, inviting the European Parliament and the Council of the European Union to sign up for it. We want to ensure that all our European initiatives, wherever possible, include a cycling dimension; supporting sustainable urban mobility plans, doubling the number of safe cycling infrastructures or creating more bicycle parking facilities. By taking action to promote cycling, we’re not only helping the environment, but we’re also supporting a growing biking industry. #DYK that 8 out of 10 electric bikes sold in Europe are made in Europe? ?? Let's work together to support the growth of the biking industry while creating a more sustainable and healthy future for all. #EUGreenDeal",photo,2023-04-09 10:30:02 UTC,1679,1358,188,133,1400000,Facebook,0.119928571
European Commission,107898832590939,107898832590939_603330771832056,"Russia's attack on the Kramatorsk train station was shocking. One year ago, 61 people were killed and scores of others were injured, many of whom critically. What happened on 8 April 2022 was a brutal, indiscriminate bombing of innocent civilians, including many children, fleeing amid fears of another Russian onslaught against their homes and country. Kramatorsk, Bucha and other Ukrainian towns and villages have been part of the Kremlin's deplorable destruction tactics. Putin must be held accountable for his crimes. Not only do we want Russia's criminal plan to fail. We also want justice for Ukraine and for Ukrainians. We stand with the victims of these atrocities, we #StandWithUkraine",photo,2023-04-08 15:30:00 UTC,2634,1798,623,213,1400000,Facebook,0.188142857
European Commission,107898832590939,107898832590939_601998988631901,"Discrimination has no place in our union. On International Roma Day, we celebrate the rich diversity, language, art and culture of the Roma. They are Europe's largest ethnic minority with a population of around 10-12 million. Although there have been some improvements in education, Roma still face marginalisation and widespread discrimination, leading to socio-economic exclusion in everyday life. This year, we are proud to work with the Council of Europe on the EQUIROM project to combat stereotypes about Roma in the media. We believe that every individual deserves equal treatment and respect, and we are committed to turning this vision into reality for all in our #UnionOfEquality. #EU4Roma #UnitedInDiversity",photo,2023-04-08 10:30:01 UTC,1313,981,190,142,1400000,Facebook,0.093785714
European Commission,107898832590939,107898832590939_602122281952905,"IRIS ² is the latest addition to our constellations of satellites. IRIS ² has a Secure Connectivity system which will strengthen our resilience and reaction capacity against cyber threats. It also bring connectivity to the entire Europe, including zones that do not currently have signals at all. Together with our existing space programmes Galileo and Copernicus, IRIS² creates a sovereign and secure communication service for our Union and its partners. EU satellite constellations also help fight climate change: Copernicus, for example, collects data on climate, land and oceans for a more sustainable future. Here are 4 pictures of EU capital cities taken by Copernicus! Share their names with us in the comments! #EUSpace #EuropeanUnion",photo,2023-04-07 15:30:00 UTC,327,250,39,38,1400000,Facebook,0.023357143
European Commission,107898832590939,107898832590939_602005035297963,"Today is World Health Day. But no matter the day, we continue to take steps to build a more resilient Health Union for the future. A Union that ensures access to safe, effective, and affordable healthcare for all EU citizens. To achieve this goal, we have launched several initiatives: ?? the Pharmaceutical Strategy for Europe which will improve access to safe and affordable medicines and treatment, ??️ the Europe's Beating Cancer Plan which will monitor inequalities in access to cancer prevention and care and support efforts to improve patients' access to healthcare, ?? the EU4Health programme with an unprecedented budget of €5.3 billion, which will address inequalities across EU countries and improve access. ?? our Health Emergency Preparedness and Response Authority with the mission to prevent, detect, and rapidly respond to health emergencies. #WorldHealthDay #HealthUnion",photo,2023-04-07 09:30:00 UTC,635,444,103,88,1400000,Facebook,0.045357143
European Commission,107898832590939,107898832590939_602717371893396,"EU-China relations are extensive and complex. How we manage them will impact EU prosperity and security. This relationship – and its future – have been at the core of President Ursula von der Leyen’s visit to Beijing. With Premier Li, President von der Leyen discussed how to rebalance our trade and mentioned during her press conference the possibility to resume our High Level Economic and Trade Dialogue to engage on this. The meeting with President Xi and President Emmanuel Macron has been the opportunity to address imbalances in our economic relations and look at cooperation on pressing global issues like Russia’s war and global change climate. Together with China, we have the duty to uphold and promote the rules-based international order. Starting with the end of the Russian invasion and withdrawal of its troops. President von der Leyen highlighted the need to address imbalances and risks stemming from dependencies and export of sensitive tech, and to remain vigilant on China’s actions on Ukraine. She also stressed our concerns on human rights. #EuropeanUnion",photo,2023-04-06 17:50:35 UTC,4179,3022,730,427,1400000,Facebook,0.2985
European Commission,107898832590939,107898832590939_602534471911686,"Did you know that 5.8 million tonnes of textiles are discarded every year in the EU? That's 11.3 kg per person! Textile consumption is one of the top three pressures on water and land use. The sector has also the fourth highest impact on the environment and climate change, after food, housing, and transport. We need to move towards a more sustainable and circular textiles sector. It’s part of our Circular Economy Action Plan that covers the whole economy. Our proposals will ensure that by 2030, all textile products placed on the EU market are long-lived and recyclable and produced in respect of social rights and the environment. #ReFashionNow",photo,2023-04-06 10:00:04 UTC,989,760,119,110,1400000,Facebook,0.070642857
European Commission,107898832590939,107898832590939_602025091962624,"All the single bees! All the single bees! Now put your wings up! ???? We may need to work on the lyrics, but we're serious about protecting our pollinating friends. With over 1 million citizens supporting the European Citizens' Initiative, the call to phase out synthetic pesticides by 2035, restore biodiversity, and support farmers in transitioning to sustainable practices is loud and clear. We now call on the European Parliament and Council to quickly turn these actions into laws while maintaining high targets for the Common Agricultural Policy and European Green Deal. By doing so, we can protect our food supply, our environment and the future of our pollinators. #EUTakeTheInitiative #Sustainability #SaveTheBees",photo,2023-04-05 15:30:00 UTC,981,763,96,122,1400000,Facebook,0.070071429
European Commission,107898832590939,107898832590939_601410912024042,War criminals must be held accountable for their deeds. Putin must be held accountable for his crimes. The EU will continue to spearhead efforts to ensure accountability by: ?? Working on the collection of evidence; ?? Bringing prosecutors together; ?? Setting up an International Coordination Centre for the Prosecution of the Crime of Aggression; ?? Supporting the creation of a dedicated tribunal if that's what it takes. Not only do we want Russia's criminal plan to fail. We also want justice for Ukraine and for Ukrainians. #StandWithUkraine,photo,2023-04-05 09:30:00 UTC,2757,1821,730,206,1400000,Facebook,0.196928571
European Commission,107898832590939,107898832590939_601461348685665,"?? Missed your jump over the mushroom? ?? Splatted next to your target? ?? Drifted your kart outside the track? This shall happen no more! We've recently contacted Nintendo to address the recurring technical problem with defective Switch controllers, and we're happy to report that they've agreed to offer all consumers the right to repair, free of charge, even beyond the legal guarantee! This will prevent the disposal of unrepaired controllers and unnecessary waste. ?? So don't wait, jump into action and get your controllers repaired for free. Let's-a go! #EuropeanUnion #Right2Repair #Nintendo #Switch",photo,2023-04-04 13:21:10 UTC,1353,1052,171,130,1400000,Facebook,0.096642857
