Fanpage,Page_Id,Post_Id,Message,Type,Date,Reactions,Likes,Comments,Shares,Fans,Page,ER
European Commission,157981564,1648648347731861505,"Today, we've launched the Public Buyers Community Platform to facilitate cooperation and knowledge-sharing between public buyers across ????. The launch is a significant step towards achieving our goals of promoting transparency, fairness and competition in public procurement. ↓",status,2023-04-19 14:22:51 UTC,81,51,2,22,1800000,Twitter,0.0045
European Commission,157981564,1648627545175216128,?? Our nature. ?? Our biodiversity. ?? Our responsibility. We have launched the #EULife23 Call: €611 million are available for your #LIFEprojects proposals on environmental and climate action solutions. Apply now ↓ #EUGreenDeal,status,2023-04-19 13:00:11 UTC,187,122,4,36,1800000,Twitter,0.010388889
European Commission,157981564,1648589751333650432,"At the heart of the €800 billion #NextGenerationEU plan, the Recovery and Resilience Fund has been a vital instrument in rebuilding our economies after the COVID-19 pandemic. Two years after its adoption, it remains a central driver of the EU’s green and digital transformation.",status,2023-04-19 10:30:00 UTC,212,114,5,49,1800000,Twitter,0.011777778
European Commission,157981564,1648574651818455040,"Putin must be held accountable for his crimes. For the first time in history, the @IntlCrimCourt has issued an arrest warrant for a leader of a permanent member of the UN Security Council. There will be no escape for the perpetrator and his henchmen. #StandWithUkraine",status,2023-04-19 09:30:00 UTC,6072,4255,63,979,1800000,Twitter,0.337333333
European Commission,157981564,1648358663596253184,RT @vonderleyen: I very much welcome the political agreement on the #EUChipsAct   The #EUChipsAct will allow for a competitive chips indust…,status,2023-04-18 19:11:45 UTC,0,,,,1800000,Twitter,0
European Commission,157981564,1648356427210059778,We welcome the political agreement reached today by the @Europarl_EN and the EU countries on the #EUChipsAct. This paves the way to ensure Europe’s digital sovereignty and will ensure that we reach our objective to double our global market share by 2030 to 20%. #DigitalEU https://t.co/DkzSqL1Ymt,status,2023-04-18 19:02:51 UTC,161,91,2,46,1800000,Twitter,0.008944444
European Commission,157981564,1648346899273900034,Be part of the #NewEuropeanBauhaus movement: We are calling for projects to: ??support the sustainable reconstruction of Ukrainian cities that have suffered the Russian destruction ??foster sustainable construction skills in Europe #EUGreenDeal #StandWithUkraine,status,2023-04-18 18:25:00 UTC,159,84,2,40,1800000,Twitter,0.008833333
European Commission,157981564,1648340623005560832,"Strong banks are vital for the EU economy. As we complete the #BankingUnion, we're proposing reforms to protect financial stability and prevent bank failures. This means that any bank can exit the market smoothly, benefiting taxpayers, financial stability &amp; depositors. #CMDI",status,2023-04-18 18:00:03 UTC,111,63,5,32,1800000,Twitter,0.006166667
European Commission,157981564,1648334540178325506,Today we mark the registration of 1⃣0⃣0⃣ European Citizens’ Initiatives – a remarkable achievement for direct democracy. Stay informed and involved by exploring the ongoing initiatives on the ECI website. #EUTakeTheInitiative,status,2023-04-18 17:35:53 UTC,118,68,5,35,1800000,Twitter,0.006555556
European Commission,157981564,1648332205343535107,"We also present a Cybersecurity Skills Academy to help increase the number of skilled cybersecurity professionals in the EU. It will bring together private and public initiatives on cybersecurity skills, making them more visible and helping close the cybersecurity talent gap. https://t.co/3CyrYVLoYX",status,2023-04-18 17:26:36 UTC,66,43,0,20,1800000,Twitter,0.003666667
European Commission,157981564,1648328913817411586,"The proposal introduces a: → European Cyber Shield, an infrastructure of Security Operations Centres across the EU → Cyber Emergency Mechanism to strengthen preparedness to cybersecurity threats → Cybersecurity Incident Review Mechanism to assess significant incidents https://t.co/Zs6u5dKRul",status,2023-04-18 17:13:32 UTC,71,46,2,18,1800000,Twitter,0.003944444
European Commission,157981564,1648328858695786497,"RT @vonderleyen: We step up EU solidarity to better detect, prepare and respond to cyber threats with the Cyber Solidarity Act: → a Cyber…",status,2023-04-18 17:13:19 UTC,0,,,,1800000,Twitter,0
European Commission,157981564,1648327680985636869,"It is essential for Europe to invest in and strengthen its cybersecurity capabilities. The Cyber Solidarity Act proposal aims to reinforce the EU’s coordinated actions to detect, prepare for and effectively respond to growing cybersecurity threats and incidents. ↓ #DigitalEU",status,2023-04-18 17:08:38 UTC,267,167,12,75,1800000,Twitter,0.014833333
European Commission,157981564,1648313946254745600,"A digital Europe needs to lead both in technology and in education. Today, we adopted two proposals to enable governments and educators to provide high-quality, inclusive and accessible digital education and training to all European citizens. #EuropeanYearOfSkills Learn more ↓",status,2023-04-18 16:14:03 UTC,198,116,10,40,1800000,Twitter,0.011
European Commission,157981564,1648306441697083393,"From biotech to AI: Deep tech accounts for over a quarter of Europe's start-up ecosystem. Yet women remain largely underrepresented across this industry. Last week, we announced a list of 134 female-led deep tech companies to be supported under the 2nd edition of #WomenTechEU.",status,2023-04-18 15:44:14 UTC,107,80,1,18,1800000,Twitter,0.005944444
European Commission,157981564,1648271018388074497,"RT @vonderleyen: 2 years ago we presented the laws to deliver the #EUGreenDeal With today’s votes, we reach another milestone. I want to…",status,2023-04-18 13:23:28 UTC,0,,,,1800000,Twitter,0
European Commission,157981564,1648256517903187968,"Like the design of the Las Setas building in Seville, algorithms are complex structures that shape our online experience. This is what we are working on at the European Centre for Algorithmic Transparency. We want to make the online experience safer for all. #DigitalEU",status,2023-04-18 12:25:51 UTC,361,226,17,93,1800000,Twitter,0.020055556
European Commission,157981564,1648226131718406149,RT @vonderleyen: In the last decades China has become an economic powerhouse and a key global player. It is now reducing its dependency on…,status,2023-04-18 10:25:07 UTC,0,,,,1800000,Twitter,0
European Commission,157981564,1648212261763448833,"This week, the #vdLCommission meets to discuss: ?? Cybersecurity in the EU ?? Digital skills in education and training ?? Bank crisis management https://t.co/C4J7GzrgzJ",status,2023-04-18 09:30:00 UTC,142,88,2,39,1800000,Twitter,0.007888889
European Commission,157981564,1647985773092716544,"The EU budget is not a zero-sum game. Everybody wins from EU membership, enjoying borderless travel, roaming calls or a coordinated response to the different challenges the EU faces. Find out the facts about how the EU budget works and how it benefits you directly. ↓",status,2023-04-17 18:30:01 UTC,244,151,4,59,1800000,Twitter,0.013555556
European Commission,157981564,1647978920229076993,"Ukrainian cultural heritage is at risk. We remain fully by Ukraine’s side in protecting cultural heritage. If you're an expert in preserving cultural heritage, join us to safeguard Ukraine's history ????. Apply by April 25 → https://t.co/d1xTpRpZ3w #StandWithUkraine",status,2023-04-17 18:02:47 UTC,618,408,6,113,1800000,Twitter,0.034333333
European Commission,157981564,1647962513131151360,RT @vonderleyen: Congratulations @kajakallas for your new term as Estonian Prime Minister. We will continue to work together to end Russi…,status,2023-04-17 16:57:35 UTC,0,,,,1800000,Twitter,0
European Commission,157981564,1647957303700668418,"""The European Union strongly condemns the sentencing of Vladimir Kara-Murza. This is yet another demonstration by Russian authorities of the political misuse of judiciary. We call on Russia to immediately release all those imprisoned for politically motivated charges.""",status,2023-04-17 16:36:53 UTC,909,567,24,179,1800000,Twitter,0.0505
European Commission,157981564,1647911051579609092,"????Today, we adopted new EU rules to reduce the ‘standby’ consumption of electrical appliances. The revised rules are estimated to amount to annual savings of €530 million for consumers, as well as annual CO2 savings of 1.36 million tonnes of CO2 equivalent by 2030. ↓",status,2023-04-17 13:33:06 UTC,489,315,19,110,1800000,Twitter,0.027166667
European Commission,157981564,1647863497676537856,We want to contribute to smooth travel across EU borders. That’s why we've launched a public consultation on the digitalisation of travel documents and the facilitation of travel. The contributions will help establish a uniform standard in the Schengen area. #EUHaveYourSay,status,2023-04-17 10:24:08 UTC,459,242,20,98,1800000,Twitter,0.0255
European Commission,157981564,1647663802635223041,"RT @vonderleyen: Warm Easter wishes to the Ukrainian people. As light overcomes darkness, you will prevail. We stand with you as long as…",status,2023-04-16 21:10:37 UTC,0,,,,1800000,Twitter,0
European Commission,157981564,1647616839017725955,"The next step on our journey to net-zero emissions will be the proposal of intermediate targets for 2040. We need to create a predictable environment to guide citizens’, investment, and political decisions. And you can help to shape it ?? https://t.co/iTPRPoZViu #EUHaveYourSay https://t.co/nIiSWYptLd",status,2023-04-16 18:04:00 UTC,338,206,12,71,1800000,Twitter,0.018777778
European Commission,157981564,1647585636256235521,"The EU will be the first region worldwide to have a driving licence that works across borders: ?? it will be accessible through a mobile phone, and ?? would be recognised throughout the EU. This would make it easier to replace, renew or exchange a driving licence at EU level. https://t.co/y90Pe08qBX",status,2023-04-16 16:00:01 UTC,798,515,23,167,1800000,Twitter,0.044333333
European Commission,157981564,1647551422349574145,"You??: I still remember that cell phone. And do you also remember how much it costs to call another EU country?: ??EU With our roaming legislation extended for 10 more years, Europeans can continue calling with the same conditions as at home. #EURoaming https://t.co/T3QwZBBTgF",status,2023-04-16 13:44:03 UTC,625,448,16,105,1800000,Twitter,0.034722222
European Commission,157981564,1647496042831659010,Russia's war of aggression has wreaked havoc on the lives of the people of Ukraine. Our support has been unwavering. And people across Europe have taken action to offer Ukrainians unconditional help and assistance. Discover how ⬇ #StandWithUkraine,status,2023-04-16 10:04:00 UTC,1076,604,10,151,1800000,Twitter,0.059777778
European Commission,157981564,1647253458913837057,"All Ukrainian refugees considered temporary residents in the EU have the right to open a bank account. With a basic bank account, refugees can have access to basic services that we all need in our daily lives. ???????? https://t.co/a5snk6uLPe #StandWithUkraine https://t.co/WlPL9WpLvQ",status,2023-04-15 18:00:03 UTC,381,262,7,68,1800000,Twitter,0.021166667
European Commission,157981564,1647223252517892098,"How competitive is your region? Find out in the Regional Competitiveness Index interactive tool. The revised index will allow us to draw better policies, which can provide attractive and sustainable living conditions for citizens in Europe’s regions. ↓",status,2023-04-15 16:00:01 UTC,309,204,7,60,1800000,Twitter,0.017166667
European Commission,157981564,1647178198726361091,Climate change is affecting countries in the EU and worldwide. Find out more about what the EU is doing to prepare for climate risks and how the #EUCivilProtection Mechanism helps respond to wildfires/floods/tropical storms and other disasters. #TogetherOneStepAhead @eu_echo https://t.co/SdKiFLH3Lo,status,2023-04-15 13:01:00 UTC,216,110,5,47,1800000,Twitter,0.012
European Commission,157981564,1647147751145177089,"The EU is all around you. In bridges, metros, airports, high-speed trains, and so much more. In 30 years, the Cohesion Fund has invested almost €179 billion in many projects in our Union. It has helped to create a more level playing field in the EU.",status,2023-04-15 11:00:01 UTC,475,344,7,75,1800000,Twitter,0.026388889
European Commission,157981564,1647133151758544897,"Are you changing to summer tyres on your car? The EU energy label highlights the tyre's performance on issues relating to fuel efficiency, safety and noise. Learn more to make an informed purchase decision when replacing the tyres ???? https://t.co/R6kHzUm5Kb https://t.co/EyY37UQopk",status,2023-04-15 10:02:00 UTC,327,209,4,69,1800000,Twitter,0.018166667
European Commission,157981564,1646894931380715523,Breaking barriers and boosting innovation: 134 female-led deep-tech companies were funded under the 2nd edition of #WomenTechEU. The companies selected will contribute to enhancing the quality of life for the citizens of the EU and beyond. #HorizonEU,status,2023-04-14 18:15:24 UTC,198,121,3,46,1800000,Twitter,0.011
European Commission,157981564,1646875667894501381,The EU will continue to spearhead efforts to ensure accountability by: ?? collecting evidence ?? bringing prosecutors together ?? setting up an International Coordination Centre for the Prosecution of the Crime of Aggression ?? supporting the creation of a dedicated tribunal,status,2023-04-14 16:58:51 UTC,455,344,0,80,1800000,Twitter,0.025277778
European Commission,157981564,1646875436217933825,"Putin must be held accountable for his crimes. For the first time in history, the @IntlCrimCourt has issued an arrest warrant for a leader of a permanent member of the UN Security Council. There will be no escape for the perpetrator and his henchmen. #StandWithUkraine https://t.co/0jxp5SfXOH",status,2023-04-14 16:57:56 UTC,5880,4132,69,997,1800000,Twitter,0.326666667
European Commission,157981564,1646855757004931074,"Russia’s war of aggression blocked Ukraine’s key transport routes. Since May 2022, our Solidarity Lanes have been transporting essential goods such as fuel, grain &amp; humanitarian aid where they need to go–via rail, road and inland waterways. Watch #SolidarityLanes in action ↓ https://t.co/Dv70E4oMPQ",status,2023-04-14 15:39:44 UTC,321,205,5,62,1800000,Twitter,0.017833333
European Commission,157981564,1646814764369059840,"Ukrainian cultural heritage remains under considerable threat of further destruction and damage. If you're an expert in preserving cultural heritage, join us in safeguarding Ukraine's heritage ???? before 25 April. More info → https://t.co/d1xTpRpZ3w #StandWithUkraine",status,2023-04-14 12:56:50 UTC,380,215,9,88,1800000,Twitter,0.021111111
European Commission,157981564,1646770927718236160,"In 2020, EU exports to Japan went up by 6.6% compared to the same period the year before. Japan is the EU’s second-biggest trading partner in Asia. The Agreement is the bedrock of ???????? trade relations and forms the cornerstone of a strong political relationship. #EUTrade https://t.co/KBDOH6CVkr",status,2023-04-14 10:02:39 UTC,125,92,0,26,1800000,Twitter,0.006944444
European Commission,157981564,1646770528470937601,"???????? The EU-Japan trade agreement works. In 2022, trade between the EU and Japan grew by 13.4% thanks to our Economic Partnership Agreement. In 2021, trade in goods between the two partners already recovered to pre-pandemic levels thanks to the Agreement. ↓",status,2023-04-14 10:01:04 UTC,557,388,13,131,1800000,Twitter,0.030944444
European Commission,157981564,1646515442499088388,"If you are fleeing the war in Ukraine and coming to the EU, you can find information on our webpage about: ??Travel ??Children protection ?? Education ??Healthcare ??Jobs ??Housing ??Safety ??#StandWithUkraine ➞ https://t.co/3OcBx2LM73",status,2023-04-13 17:07:26 UTC,255,166,5,57,1800000,Twitter,0.014166667
European Commission,157981564,1646490911461855232,Russia’s war crimes will not go unpunished. We are determined to ensure that the perpetrators of the barbaric acts committed during this invasion will pay for their crimes and that Russia will be held accountable for the crime of aggression. https://t.co/1TzwO3lLDa,status,2023-04-13 15:29:58 UTC,1202,637,20,177,1800000,Twitter,0.066777778
European Commission,157981564,1646475683156090880,"Solidarity with Ukraine has no borders. 169 generators have arrived in Ukraine from Australia, coordinated via the #rescEU energy hub in Poland. To date, ???? has coordinated some 3,000 power generators to Ukraine via donations and own reserves. #StandWithUkraine",status,2023-04-13 14:29:27 UTC,692,485,13,127,1800000,Twitter,0.038444444
European Commission,157981564,1646459136786198530,RT @JosepBorrellF: Deeply shocked by the brutal video of decapitation of a Ukrainian prisoner of war. It is a despicable breach of the Gene…,status,2023-04-13 13:23:42 UTC,0,,,,1800000,Twitter,0
European Commission,157981564,1646445877253349377,"- give employment opportunities in another EU country to 3.4% of EU citizens, while opening opportunities in deep and clean tech - spearheading the future by promoting an EU-wide #CircularEconomy and the #NetZeroIndustry Discover more achievements ➡ https://t.co/sNhsYu4UyZ",status,2023-04-13 12:31:01 UTC,195,144,2,38,1800000,Twitter,0.010833333
European Commission,157981564,1646445873155457024,"The Single Market is Europe's crown jewel. A market where 450 million people are free to study, live, shop, work and retire and enjoy products from all over Europe. A global champion worth €14.5 trillion, empowering 23 million businesses to move and trade ⬇ #SingleMarket https://t.co/YvZRDUIkwN",status,2023-04-13 12:31:00 UTC,1309,873,42,307,1800000,Twitter,0.072722222
European Commission,157981564,1646445875500048384,"Thanks to the Single Market, we have been able to: - develop 3,600 harmonised standards, from toy safety to packaging waste - open up EU-wide trade for 9% of EU enterprises with e-commerce sales, and enable others to boost their online business with the Digital Markets Act ⬇",status,2023-04-13 12:31:00 UTC,195,152,1,36,1800000,Twitter,0.010833333
European Commission,157981564,1646412300130164737,"#NextGenerationEU: ??make it green ??make it digital ??make it healthy ??make it strong ??make it equal ✅make it real! For what’s coming and how we are turning the EU vision into reality, take a look at the Recovery and Resilience Scoreboard: https://t.co/IqDdc7mfII https://t.co/5eNJwrvDMB",status,2023-04-13 10:17:35 UTC,87,52,1,22,1800000,Twitter,0.004833333
European Commission,157981564,1646410505307684865,"To date, we have disbursed €150 billion under the Recovery and Resilience Facility for ??green transition ??smart, sustainable and inclusive growth ?? social &amp; territorial cohesion ??health and economic resilience ??digital transformation ??policies for the #NextGenerationEU https://t.co/TLat6hLZLP",status,2023-04-13 10:10:27 UTC,83,53,1,20,1800000,Twitter,0.004611111
European Commission,157981564,1646407875995271168,"Greener, stronger &amp; better prepared for the future! In just over 2 years of existence, the Recovery and Resilience Facility has been driving hundreds of reforms &amp; investments across ????. Check out our interactive map &amp; explore over 350 projects funded so far. #NextGenerationEU",status,2023-04-13 10:00:01 UTC,277,174,6,68,1800000,Twitter,0.015388889
European Commission,157981564,1646160814536028161,"Nothing about us without us. With our Strategy for the Rights of Persons with Disabilities, we are working together to create an inclusive society, improving access to jobs, education, justice, culture, sport and health services by 2030 ↓ #TogetherForRights #EUDisabilityRights",status,2023-04-12 17:38:17 UTC,173,99,4,45,1800000,Twitter,0.009611111
European Commission,157981564,1646147614331600898,@defis_eu Congratulations!,status,2023-04-12 16:45:49 UTC,3,2,0,1,1800000,Twitter,0.000166667
European Commission,157981564,1646135940241412097,The adoption of the 2020-2025 LGBTIQ equality strategy was a positive breakthrough for the promotion of the LGBTIQ rights in the EU and beyond. The majority of the measures contained in the strategy have either been delivered or are being implemented. #UnionOfEquality ↓,status,2023-04-12 15:59:26 UTC,370,166,12,62,1800000,Twitter,0.020555556
European Commission,157981564,1646092662401818626,"The next step on our journey to net-zero emissions will be the proposal of intermediate targets for 2040. We need to create a predictable environment to guide citizens’, investment, and political decisions. And you can help to shape it ?? https://t.co/iTPRPoZViu #EUHaveYourSay https://t.co/GotBvnSsI3",status,2023-04-12 13:07:28 UTC,297,157,5,75,1800000,Twitter,0.0165
European Commission,157981564,1646071743348342785,"In addition, we will promote the adoption of proposals on: ?? a scheme for the boarding and inspection of vessels in the high seas ?? improving the compliance process on fishing activities ?? management of drifting fish aggregating devices",status,2023-04-12 11:44:20 UTC,39,25,0,8,1800000,Twitter,0.002166667
European Commission,157981564,1646037936344039424,"??By 2030, we want to plant three billion additional trees. With our Forest Strategy, we are taking action to protect and restore forests while ensuring they are managed more sustainably. You can be part of this effort by using the 'MapMyTree' app! #EUGreenDeal #3BillionTrees",status,2023-04-12 09:30:00 UTC,567,369,9,134,1800000,Twitter,0.0315
European Commission,157981564,1645805374484926468,28 projects were selected from the latest @HorizonEU calls aiming to bring cutting-edge tech to where it can make a real difference. The EU will invest €180 million in: ?? basic research in AI ?? robotics ?? graphene and other two-dimensional materials Read more ↓,status,2023-04-11 18:05:53 UTC,232,115,5,46,1800000,Twitter,0.012888889
European Commission,157981564,1645770606900649984,"The current situation of the stock and the level of fishing in the Indian Ocean are not sustainable. Today, we made proposals for the conservation and sustainable management of tuna to drastically reduce illegal, unreported and unregulated fishing activities. Learn more ↓",status,2023-04-11 15:47:44 UTC,325,191,9,69,1800000,Twitter,0.018055556
European Commission,157981564,1645727828674060293,A #GlobalGateway for people and planet. In 2023 almost 90 projects across partner countries will promote: ?? sustainable mobility ?? clean energy ?? digital connectivity ?? strong health systems ?? research and innovation Discover our flagship global projects ↓,status,2023-04-11 12:57:45 UTC,199,112,5,59,1800000,Twitter,0.011055556
European Commission,157981564,1645675548356517889,"Ukrainian cultural heritage is at risk. We remain fully by Ukraine’s side in protecting cultural heritage. If you're an expert in preserving cultural heritage, join us to safeguard Ukraine's history ????. Apply by April 25 → https://t.co/d1xTpRpZ3w #StandWithUkraine https://t.co/RiF7C5rxTW",status,2023-04-11 09:30:00 UTC,1378,818,26,245,1800000,Twitter,0.076555556
European Commission,157981564,1645441514162593793,"More than a year ago we activated the Temporary Protection Directive to support people fleeing the horrors of war. To date, more than 4 million Ukrainians have found shelter in the EU. We welcome with open arms those who have to flee from Putin’s bombs. #StandWithUkraine https://t.co/BxaJaqupqC",status,2023-04-10 18:00:02 UTC,352,187,5,79,1800000,Twitter,0.019555556
European Commission,157981564,1645411310673481730,"Our Temporary Protection allows people fleeing Putin's war to register in any country in the EU with the right to access housing, healthcare, education and work. Find information about your rights in the EU, how to travel safely and contact details ↓ #StandWithUkraine",status,2023-04-10 16:00:01 UTC,266,149,6,58,1800000,Twitter,0.014777778
European Commission,157981564,1645366015860121600,"25 years ago, brave leaders made the impossible come true by signing the Good Friday (Belfast) Agreement. It not only ended 30 years of the Troubles, but also opened a new era of cooperation. The Windsor Framework supports the same spirit and promise. https://t.co/yXT4Q0ImeE",status,2023-04-10 13:00:02 UTC,697,419,12,136,1800000,Twitter,0.038722222
European Commission,157981564,1645313410727395330,"#DYK that prematurely tossed reparable products cause 261 million tonnes of greenhouse gas emissions in the EU every year? Within and beyond the legal guarantee, we are setting the framework with easier and cheaper options for a real 'right to repair' in the EU. #EUGreenDeal",status,2023-04-10 09:31:00 UTC,371,231,6,87,1800000,Twitter,0.020611111
European Commission,157981564,1645079122941472769,"The EU will be the first region worldwide to have a driving licence that works across borders: ?? it will be accessible through a mobile phone, and ?? would be recognised throughout the EU. This would make it easier to replace, renew or exchange a driving licence at EU level.",status,2023-04-09 18:00:01 UTC,1538,1062,56,234,1800000,Twitter,0.085444444
European Commission,157981564,1645034825584193537,"Let's-a go! Go repair your Switch controllers, free of charge. This week Nintendo agreed to address the recurring technical problem with irresponsive Switch controllers and they agreed to offer all consumers the right to repair, free of charge, even beyond the legal guarantee!",status,2023-04-09 15:04:00 UTC,521,382,18,86,1800000,Twitter,0.028944444
